{
  "$schema": "https://json-schema.org/draft/2020-12/schema",
  "$id": "https://comprehensive-fitness.local/schema/3.0.0/study_muscle_group_map.schema.json",
  "title": "study_muscle_group_map",
  "type": "array",
  "items": {
    "type": "object",
    "additionalProperties": false,
    "required": [
      "study_muscle_group_map_id",
      "study_id",
      "muscle_group_id",
      "relationship_type"
    ],
    "properties": {
      "study_muscle_group_map_id": {
        "type": [
          "string",
          "null"
        ],
        "pattern": "^[a-z][a-z0-9_]*$"
      },
      "study_id": {
        "type": [
          "string",
          "null"
        ],
        "pattern": "^[a-z][a-z0-9_]*$"
      },
      "muscle_group_id": {
        "type": [
          "string",
          "null"
        ],
        "pattern": "^[a-z][a-z0-9_]*$"
      },
      "relationship_type": {
        "type": [
          "string",
          "null"
        ]
      }
    }
  }
}
